{"id":"headless-ui-combobox","name":"Combobox","brandProfileId":"headless-ui","sourceType":"public-guideline","sourceStatus":"基于公开设计规范","sourceUrl":"https://headlessui.com/react/combobox","reviewedAt":"2026-08-13","platforms":["web","react","vue"],"category":"input","summary":"无样式的可搜索选择组件，适合自定义视觉和数据源。","anatomy":["input","options","option","label","button"],"states":["empty","open","active","selected","disabled"],"behavior":["输入过滤选项","键盘确认和取消选择"],"accessibility":["支持 active option 语义","label 与 input 关联"],"tokens":{"multiple":"boolean","virtual":"optional","by":"comparison key"},"do":["让选中状态在列表中持续可见"],"dont":["不要只展示图形选中态"],"locales":{"en":{"sourceStatus":"Based on public design guidelines","category":"Input","summary":"An unstyled searchable selection component for custom visuals and data sources.","anatomy":["Input","Options","Option","Label","Button"],"states":["Empty","Open","Active","Selected","Disabled"],"behavior":["Filter options as the user types","Confirm and cancel with keyboard"],"accessibility":["Expose the active option","Associate label and input"],"do":["Keep selection visible in the list"],"dont":["Do not show selection only graphically"]}}}
