{"id":"radix-ui-dialog","name":"Dialog","brandProfileId":"radix-ui","sourceType":"public-guideline","sourceStatus":"基于公开设计规范","sourceUrl":"https://www.radix-ui.com/primitives/docs/components/dialog","reviewedAt":"2026-08-13","platforms":["web","react"],"category":"overlay","summary":"无样式但完整处理焦点、遮罩和描述关系的对话框原语。","anatomy":["trigger","overlay","content","title","description","close"],"states":["closed","open","modal","non-modal"],"behavior":["打开时将焦点移入内容","关闭后恢复触发器焦点"],"accessibility":["标题和描述必需可关联","遮罩外内容不可操作"],"tokens":{"modal":"boolean","onOpenChange":"callback","container":"portal"},"do":["为危险操作提供明确标题"],"dont":["不要省略 close affordance"],"locales":{"en":{"sourceStatus":"Based on public design guidelines","category":"Overlay","summary":"An unstyled dialog primitive that handles focus, overlay, and description relationships.","anatomy":["Trigger","Overlay","Content","Title","Description","Close"],"states":["Closed","Open","Modal","Non-modal"],"behavior":["Move focus into content on open","Restore trigger focus on close"],"accessibility":["Associate title and description","Prevent interaction outside a modal"],"do":["Give destructive actions a clear title"],"dont":["Do not omit a close affordance"]}}}
