{"id":"polaris-index-table","name":"Index table","brandProfileId":"shopify-polaris","sourceType":"public-guideline","sourceStatus":"基于公开设计规范","sourceUrl":"https://polaris.shopify.com/components/tables/index-table","reviewedAt":"2026-08-13","platforms":["web","react"],"category":"data","summary":"用于订单、商品、客户等资源列表的浏览、选择和批量操作。","anatomy":["resource name","header","row","selection","bulk actions","pagination"],"states":["loading","empty","selected","filtered","sorted"],"behavior":["选择后显示批量操作","窄屏切换为 condensed 结构"],"accessibility":["资源名称描述表格用途","选择数量可被播报"],"tokens":{"selectable":"boolean","condensed":"responsive","headings":"array"},"do":["把资源标识放在首列"],"dont":["不要把不相关资源混在一个 index"],"locales":{"en":{"sourceStatus":"Based on public design guidelines","category":"Data display","summary":"Browses, selects, and performs bulk actions on orders, products, customers, and other resources.","anatomy":["Resource name","Header","Row","Selection","Bulk actions","Pagination"],"states":["Loading","Empty","Selected","Filtered","Sorted"],"behavior":["Show bulk actions after selection","Use a condensed structure on narrow screens"],"accessibility":["Name the resource set","Announce selection count"],"do":["Put resource identity in the first column"],"dont":["Do not mix unrelated resources in one index"]}}}
