{"id":"primer-dialog","name":"Dialog","brandProfileId":"github-primer","sourceType":"public-guideline","sourceStatus":"基于公开设计规范","sourceUrl":"https://primer.style/product/components/dialog/","reviewedAt":"2026-08-13","platforms":["web","react"],"category":"overlay","summary":"在 GitHub 风格工作流中完成确认、配置与短表单。","anatomy":["header","title","body","footer","close"],"states":["closed","open","narrow","wide","danger"],"behavior":["焦点在打开和关闭间正确恢复","滚动内容保持动作可见"],"accessibility":["标题命名 dialog","关闭按钮有可访问名称"],"tokens":{"width":"small | medium | large | xlarge","position":"center | side"},"do":["在 footer 中保持动作顺序"],"dont":["不要在 dialog 中进行长导航"],"locales":{"en":{"sourceStatus":"Based on public design guidelines","category":"Overlay","summary":"Handles confirmations, settings, and short forms in GitHub-style workflows.","anatomy":["Header","Title","Body","Footer","Close"],"states":["Closed","Open","Narrow","Wide","Danger"],"behavior":["Restore focus correctly","Keep actions visible while content scrolls"],"accessibility":["Name the dialog with a title","Give close an accessible name"],"do":["Keep action order stable in the footer"],"dont":["Do not perform long navigation in a dialog"]}}}
