{"id":"shadcn-ui-form","name":"Form","brandProfileId":"shadcn-ui","sourceType":"public-guideline","sourceStatus":"基于公开设计规范","sourceUrl":"https://ui.shadcn.com/docs/components/form","reviewedAt":"2026-08-13","platforms":["web","react"],"category":"input","summary":"以 React Hook Form 与 Zod 组合字段、校验和错误信息。","anatomy":["field","label","control","description","message"],"states":["default","focused","invalid","submitting","success"],"behavior":["校验反馈靠近对应字段","提交中禁用重复动作"],"accessibility":["字段标签与消息关联","错误消息具有稳定语义"],"tokens":{"validation":"zod or custom","layout":"stacked","control":"composable"},"do":["让错误信息给出下一步"],"dont":["不要把 schema 错误直接暴露给用户"],"locales":{"en":{"sourceStatus":"Based on public design guidelines","category":"Input","summary":"Composes fields, validation, and error messages with React Hook Form and Zod.","anatomy":["Field","Label","Control","Description","Message"],"states":["Default","Focused","Invalid","Submitting","Success"],"behavior":["Place validation feedback beside its field","Disable duplicate actions while submitting"],"accessibility":["Associate labels and messages","Keep errors semantically stable"],"do":["Give errors a next step"],"dont":["Do not expose schema errors verbatim"]}}}
