{"id":"spectrum-table","name":"Table","brandProfileId":"adobe-spectrum","sourceType":"public-guideline","sourceStatus":"基于公开设计规范","sourceUrl":"https://spectrum.adobe.com/page/table/","reviewedAt":"2026-08-13","platforms":["web","react"],"category":"data","summary":"在创意与内容工作流中展示、选择和排序结构化资源。","anatomy":["header","row","cell","selection","sort","actions"],"states":["default","hover","selected","sorted","loading","empty"],"behavior":["列类型决定对齐方式","选择状态支持批量动作"],"accessibility":["表格关系语义化","状态不只依赖色彩"],"tokens":{"density":"compact | spacious","selection":"single | multiple","overflow":"responsive"},"do":["保持资源缩略图尺寸稳定"],"dont":["不要让行高随状态跳动"],"locales":{"en":{"sourceStatus":"Based on public design guidelines","category":"Data display","summary":"Displays, selects, and sorts structured assets in creative and content workflows.","anatomy":["Header","Row","Cell","Selection","Sort","Actions"],"states":["Default","Hover","Selected","Sorted","Loading","Empty"],"behavior":["Align by column type","Support bulk actions after selection"],"accessibility":["Express table relationships semantically","Do not rely on color for state"],"do":["Keep asset thumbnail sizes stable"],"dont":["Do not let row height shift with state"]}}}
