{"id":"mui-autocomplete","name":"Autocomplete","brandProfileId":"mui","sourceType":"public-guideline","sourceStatus":"基于公开设计规范","sourceUrl":"https://mui.com/material-ui/react-autocomplete/","reviewedAt":"2026-08-13","platforms":["web","react"],"category":"input","summary":"在输入过程中过滤并选择一个或多个建议项。","anatomy":["input","label","popup","option","loading state"],"states":["empty","focused","open","selected","loading","disabled"],"behavior":["输入过滤选项","支持自由输入或受限选择"],"accessibility":["列表和选项有语义关系","键盘可完成选择"],"tokens":{"multiple":"true | false","freeSolo":"true | false","filterOptions":"function"},"do":["显示当前选择"],"dont":["不要用模糊建议替代明确标签"],"locales":{"en":{"sourceStatus":"Based on public design guidelines","category":"Input","summary":"Filters and selects one or more suggestions while the user types.","anatomy":["Input","Label","Popup","Option","Loading state"],"states":["Empty","Focused","Open","Selected","Loading","Disabled"],"behavior":["Filter options while typing","Support free input or constrained selection"],"accessibility":["Relate listbox and options semantically","Complete selection with keyboard"],"do":["Show the current selection"],"dont":["Do not replace clear labels with fuzzy suggestions"]}}}
