{"id":"polaris-text-field","name":"Text field","brandProfileId":"shopify-polaris","sourceType":"public-guideline","sourceStatus":"基于公开设计规范","sourceUrl":"https://polaris.shopify.com/components/selection-and-input/text-field","reviewedAt":"2026-08-13","platforms":["web","react"],"category":"input","summary":"采集商品、订单与商家设置中的文本或数字。","anatomy":["label","input","prefix/suffix","help text","error"],"states":["empty","filled","focus","error","disabled","read-only"],"behavior":["按值类型选择 inputMode","前后缀解释单位或币种"],"accessibility":["标签持续可见","错误说明与字段关联"],"tokens":{"type":"text | number | email | currency","autoComplete":"string","multiline":"boolean"},"do":["明确格式和单位"],"dont":["不要把 placeholder 当标签"],"locales":{"en":{"sourceStatus":"Based on public design guidelines","category":"Input","summary":"Collects text or numbers for products, orders, and merchant settings.","anatomy":["Label","Input","Prefix/suffix","Help text","Error"],"states":["Empty","Filled","Focus","Error","Disabled","Read-only"],"behavior":["Choose inputMode by value type","Use affixes to explain units or currency"],"accessibility":["Keep labels visible","Associate errors with fields"],"do":["State formats and units"],"dont":["Do not use a placeholder as a label"]}}}
