{"id":"primer-data-table","name":"DataTable","brandProfileId":"github-primer","sourceType":"public-guideline","sourceStatus":"基于公开设计规范","sourceUrl":"https://primer.style/product/components/data-table/","reviewedAt":"2026-08-13","platforms":["web","react"],"category":"data","summary":"展示仓库、议题和审查等高密度结构化信息。","anatomy":["caption","header","row","cell","actions"],"states":["default","sorted","selected","loading","empty"],"behavior":["列宽匹配内容类型","操作列保持克制"],"accessibility":["caption 和 header 完整","排序按钮可键盘触发"],"tokens":{"cellPadding":"condensed | normal","numeric":"right aligned","stickyHeader":"optional"},"do":["用 monospace 展示代码标识"],"dont":["不要把每列设成相同宽度"],"locales":{"en":{"sourceStatus":"Based on public design guidelines","category":"Data display","summary":"Displays dense structured information for repositories, issues, and reviews.","anatomy":["Caption","Header","Row","Cell","Actions"],"states":["Default","Sorted","Selected","Loading","Empty"],"behavior":["Match column width to content type","Keep action columns restrained"],"accessibility":["Provide caption and headers","Make sorting keyboard operable"],"do":["Use monospace for code identifiers"],"dont":["Do not make every column the same width"]}}}
