{"id":"shadcn-ui-data-table","name":"Data table","brandProfileId":"shadcn-ui","sourceType":"public-guideline","sourceStatus":"基于公开设计规范","sourceUrl":"https://ui.shadcn.com/docs/components/data-table","reviewedAt":"2026-08-13","platforms":["web","react"],"category":"data","summary":"基于 TanStack Table 组合排序、筛选、分页和列可见性。","anatomy":["toolbar","header","row","cell","pagination","column menu"],"states":["loading","empty","selected","sorted","filtered"],"behavior":["状态由 URL 或本地状态保持","工具栏动作与数据集关联"],"accessibility":["表头和单元格语义完整","批量选择提供数量反馈"],"tokens":{"sorting":"state","filtering":"state","pagination":"state"},"do":["为密集数据提供筛选入口"],"dont":["不要把表格当作移动端唯一布局"],"locales":{"en":{"sourceStatus":"Based on public design guidelines","category":"Data display","summary":"Composes sorting, filtering, pagination, and column visibility with TanStack Table.","anatomy":["Toolbar","Header","Row","Cell","Pagination","Column menu"],"states":["Loading","Empty","Selected","Sorted","Filtered"],"behavior":["Persist state in URL or local state","Tie toolbar actions to the data set"],"accessibility":["Preserve header and cell semantics","Give bulk selection a count"],"do":["Provide a filtering entry point"],"dont":["Do not make the table the only mobile layout"]}}}
