{"id":"tdesign-table","name":"Table","brandProfileId":"tdesign","sourceType":"public-guideline","sourceStatus":"基于公开设计规范","sourceUrl":"https://tdesign.tencent.com/react/components/table","reviewedAt":"2026-08-13","platforms":["web","react","vue"],"category":"data","summary":"支持排序、筛选、树形、固定列、编辑和虚拟滚动的企业表格。","anatomy":["header","row","cell","selection","pagination"],"states":["loading","empty","selected","expanded","sorted"],"behavior":["复杂数据使用固定列保持识别字段","批量操作只在选择后出现"],"accessibility":["保持表头语义","选择和排序状态可读"],"tokens":{"size":"small | medium | large","rowKey":"required","layout":"auto | fixed"},"do":["为数据密度选择尺寸"],"dont":["不要在窄屏保留所有列"],"locales":{"en":{"sourceStatus":"Based on public design guidelines","category":"Data display","summary":"An enterprise table with sorting, filtering, trees, fixed columns, editing, and virtualization.","anatomy":["Header","Row","Cell","Selection","Pagination"],"states":["Loading","Empty","Selected","Expanded","Sorted"],"behavior":["Fix identifying columns in complex data","Show bulk actions after selection"],"accessibility":["Preserve header semantics","Expose selection and sort state"],"do":["Choose size by data density"],"dont":["Do not keep every column on narrow screens"]}}}
