{"id":"tdesign-dialog","name":"Dialog","brandProfileId":"tdesign","sourceType":"public-guideline","sourceStatus":"基于公开设计规范","sourceUrl":"https://tdesign.tencent.com/react/components/dialog","reviewedAt":"2026-08-13","platforms":["web","react","vue"],"category":"overlay","summary":"用于确认、信息提示与短流程输入。","anatomy":["header","body","footer","close","overlay"],"states":["closed","open","confirming","loading"],"behavior":["确认操作提供 loading 状态","完成后恢复原上下文"],"accessibility":["焦点限制在 dialog 内","标题和关闭按钮可读"],"tokens":{"mode":"modal | modeless | full-screen","placement":"center | top"},"do":["危险操作写明后果"],"dont":["不要嵌套 dialog"],"locales":{"en":{"sourceStatus":"Based on public design guidelines","category":"Overlay","summary":"Handles confirmations, information, and short input workflows.","anatomy":["Header","Body","Footer","Close","Overlay"],"states":["Closed","Open","Confirming","Loading"],"behavior":["Show loading during confirmation","Restore the original context"],"accessibility":["Trap focus inside the dialog","Name title and close button"],"do":["State destructive consequences"],"dont":["Do not nest dialogs"]}}}
