{"id":"semi-modal","name":"Modal","brandProfileId":"semi-design","sourceType":"public-guideline","sourceStatus":"基于公开设计规范","sourceUrl":"https://semi.design/en-US/feedback/modal","reviewedAt":"2026-08-13","platforms":["web","react"],"category":"overlay","summary":"用于确认、提示、业务表单和异步结果反馈。","anatomy":["title","content","footer","close","mask"],"states":["closed","open","confirming","loading","fullscreen"],"behavior":["确认动作可异步完成","关闭后清理临时状态"],"accessibility":["标题与 modal 关联","焦点进入并恢复"],"tokens":{"type":"info | success | warning | error","centered":"boolean","fullScreen":"boolean"},"do":["在内容中解释影响"],"dont":["不要用 modal 代替普通通知"],"locales":{"en":{"sourceStatus":"Based on public design guidelines","category":"Overlay","summary":"Handles confirmation, messaging, business forms, and async result feedback.","anatomy":["Title","Content","Footer","Close","Mask"],"states":["Closed","Open","Confirming","Loading","Fullscreen"],"behavior":["Complete confirmations asynchronously","Clear temporary state after close"],"accessibility":["Associate title and modal","Move and restore focus"],"do":["Explain impact in the content"],"dont":["Do not use a modal for ordinary notifications"]}}}
