{"id":"element-plus-table","name":"Table","brandProfileId":"element-plus","sourceType":"public-guideline","sourceStatus":"基于公开设计规范","sourceUrl":"https://element-plus.org/en-US/component/table.html","reviewedAt":"2026-08-13","platforms":["web","vue"],"category":"data","summary":"支持选择、排序、筛选、树形与固定表头的数据表格。","anatomy":["column","header","row","cell","summary"],"states":["loading","empty","selected","expanded","sorted"],"behavior":["根据列定义对齐和格式化","大数据使用 virtualized table"],"accessibility":["列头语义清晰","选择状态不只依赖颜色"],"tokens":{"height":"number | auto","stripe":"boolean","border":"boolean"},"do":["固定关键识别列"],"dont":["不要让单元格内容无限换行"],"locales":{"en":{"sourceStatus":"Based on public design guidelines","category":"Data display","summary":"A data table with selection, sorting, filtering, trees, and fixed headers.","anatomy":["Column","Header","Row","Cell","Summary"],"states":["Loading","Empty","Selected","Expanded","Sorted"],"behavior":["Align and format by column definition","Use virtualization for large data"],"accessibility":["Keep column headers semantic","Do not rely on color for selection"],"do":["Fix key identifying columns"],"dont":["Do not let cell content wrap indefinitely"]}}}
