{"id":"headless-ui-dialog","name":"Dialog","brandProfileId":"headless-ui","sourceType":"public-guideline","sourceStatus":"基于公开设计规范","sourceUrl":"https://headlessui.com/react/dialog","reviewedAt":"2026-08-13","platforms":["web","react","vue"],"category":"overlay","summary":"无样式的模态对话框，提供遮罩、焦点管理和关闭行为。","anatomy":["backdrop","panel","title","description","close"],"states":["closed","open","transitioning"],"behavior":["点击遮罩可按配置关闭","通过 controlled state 管理"],"accessibility":["标题和描述绑定","打开后焦点进入 panel"],"tokens":{"open":"boolean","onClose":"callback","transition":"boolean"},"do":["自定义视觉但保留语义"],"dont":["不要移除 close path"],"locales":{"en":{"sourceStatus":"Based on public design guidelines","category":"Overlay","summary":"An unstyled modal dialog with backdrop, focus management, and dismissal behavior.","anatomy":["Backdrop","Panel","Title","Description","Close"],"states":["Closed","Open","Transitioning"],"behavior":["Configure backdrop dismissal","Manage with controlled state"],"accessibility":["Bind title and description","Move focus into the panel"],"do":["Customize visuals while preserving semantics"],"dont":["Do not remove the close path"]}}}
