{"id":"arco-table","name":"Table","brandProfileId":"arco-design","sourceType":"public-guideline","sourceStatus":"基于公开设计规范","sourceUrl":"https://arco.design/react/components/table","reviewedAt":"2026-08-13","platforms":["web","react","vue"],"category":"data","summary":"面向后台产品的排序、筛选、展开、编辑与虚拟列表表格。","anatomy":["columns","header","row","cell","pagination"],"states":["loading","empty","selected","expanded","sorted"],"behavior":["列配置驱动格式与交互","大数据启用虚拟滚动"],"accessibility":["表头和单元格关系明确","键盘可到达交互列"],"tokens":{"size":"mini | small | default | medium","border":"boolean","stripe":"boolean"},"do":["保持操作列宽度稳定"],"dont":["不要让表格承担全部移动体验"],"locales":{"en":{"sourceStatus":"Based on public design guidelines","category":"Data display","summary":"An admin table with sorting, filtering, expansion, editing, and virtualization.","anatomy":["Columns","Header","Row","Cell","Pagination"],"states":["Loading","Empty","Selected","Expanded","Sorted"],"behavior":["Drive formatting and interaction from columns","Use virtualization for large data"],"accessibility":["Relate headers and cells","Make interactive columns keyboard reachable"],"do":["Keep action column width stable"],"dont":["Do not make tables the whole mobile experience"]}}}
