{"id":"primer-button","name":"Button","brandProfileId":"github-primer","sourceType":"public-guideline","sourceStatus":"基于公开设计规范","sourceUrl":"https://primer.style/product/components/button/","reviewedAt":"2026-08-13","platforms":["web","react"],"category":"action","summary":"开发者工具中的默认、主要、危险和不可见操作。","anatomy":["container","label","leading/trailing visual"],"states":["default","hover","active","focus","disabled","loading"],"behavior":["variant 表达后果","leading visual 辅助而不替代文字"],"accessibility":["按钮文字具体","icon button 提供 aria-label"],"tokens":{"variant":"default | primary | danger | invisible","size":"small | medium | large"},"do":["危险动作使用 danger"],"dont":["不要让多个 primary 竞争"],"locales":{"en":{"sourceStatus":"Based on public design guidelines","category":"Action","summary":"Default, primary, dangerous, and invisible actions for developer tools.","anatomy":["Container","Label","Leading/trailing visual"],"states":["Default","Hover","Active","Focus","Disabled","Loading"],"behavior":["Use variant to express consequence","Use visuals to support, not replace, labels"],"accessibility":["Use specific button text","Name icon buttons"],"do":["Use danger for destructive actions"],"dont":["Do not let multiple primary buttons compete"]}}}
