{"id":"chakra-ui-dialog","name":"Dialog","brandProfileId":"chakra-ui","sourceType":"public-guideline","sourceStatus":"基于公开设计规范","sourceUrl":"https://chakra-ui.com/docs/components/dialog","reviewedAt":"2026-08-13","platforms":["web","react"],"category":"overlay","summary":"支持焦点管理、关闭行为和可组合内容的对话框。","anatomy":["backdrop","positioner","content","title","close trigger"],"states":["closed","open","motion","non-dismissible"],"behavior":["由 trigger 控制打开关闭","需要时阻止点击遮罩关闭"],"accessibility":["焦点进入 dialog","标题和描述可关联"],"tokens":{"placement":"center | top","size":"xs | sm | md | lg","motionPreset":"scale | slide"},"do":["为长流程改用独立页面"],"dont":["不要把 dialog 当导航"],"locales":{"en":{"sourceStatus":"Based on public design guidelines","category":"Overlay","summary":"A composable dialog with focus management and explicit dismissal behavior.","anatomy":["Backdrop","Positioner","Content","Title","Close trigger"],"states":["Closed","Open","Motion","Non-dismissible"],"behavior":["Control open state from a trigger","Prevent backdrop dismissal when needed"],"accessibility":["Move focus into the dialog","Associate title and description"],"do":["Use a separate page for long workflows"],"dont":["Do not use a dialog as navigation"]}}}
