{"id":"chakra-ui-button","name":"Button","brandProfileId":"chakra-ui","sourceType":"public-guideline","sourceStatus":"基于公开设计规范","sourceUrl":"https://chakra-ui.com/docs/components/button","reviewedAt":"2026-08-13","platforms":["web","react"],"category":"action","summary":"可主题化的操作控件，支持变体、尺寸、加载与禁用状态。","anatomy":["button","label","optional icon"],"states":["default","hover","active","loading","disabled"],"behavior":["用 variant 表达层级","loading 时保留操作上下文"],"accessibility":["支持键盘焦点","图标按钮提供名称"],"tokens":{"variant":"solid | outline | ghost","size":"sm | md | lg","colorPalette":"theme token"},"do":["复用主题令牌"],"dont":["不要让颜色成为唯一语义"],"locales":{"en":{"sourceStatus":"Based on public design guidelines","category":"Action","summary":"A themeable action control with variants, sizes, loading, and disabled states.","anatomy":["Button","Label","Optional icon"],"states":["Default","Hover","Active","Loading","Disabled"],"behavior":["Express hierarchy with variants","Preserve context while loading"],"accessibility":["Support keyboard focus","Name icon-only buttons"],"do":["Reuse theme tokens"],"dont":["Do not make color the only meaning"]}}}
