{"id":"ant-design-form","name":"Form","brandProfileId":"ant-design","sourceType":"public-guideline","sourceStatus":"基于公开设计规范","sourceUrl":"https://ant.design/components/form","reviewedAt":"2026-08-13","platforms":["web","react"],"category":"input","summary":"组织字段、校验、布局和提交状态。","anatomy":["form item","label","control","help","error"],"states":["default","focused","validating","error","disabled"],"behavior":["按任务分组字段","在提交前显示可修复错误"],"accessibility":["关联 label 与错误说明","键盘顺序符合任务顺序"],"tokens":{"layout":"horizontal | vertical | inline","labelCol":"configurable","validateStatus":"success | warning | error"},"do":["保持字段分组稳定"],"dont":["不要隐藏必填规则"],"locales":{"en":{"sourceStatus":"Based on public design guidelines","category":"Input","summary":"Organizes fields, validation, layout, and submission states.","anatomy":["Form item","Label","Control","Help","Error"],"states":["Default","Focused","Validating","Error","Disabled"],"behavior":["Group fields by task","Show recoverable errors before submit"],"accessibility":["Associate labels and errors","Keep keyboard order task-oriented"],"do":["Keep field groups stable"],"dont":["Do not hide required rules"]}}}
