{"id":"fluent-2-data-grid","name":"DataGrid","brandProfileId":"fluent-2","sourceType":"public-guideline","sourceStatus":"基于公开设计规范","sourceUrl":"https://react.fluentui.dev/?path=/docs/components-datagrid--docs","reviewedAt":"2026-08-13","platforms":["web","react"],"category":"data","summary":"支持排序、选择、键盘导航与列结构的企业数据网格。","anatomy":["header row","header cell","row","cell","selection"],"states":["default","focused","selected","sorted","loading"],"behavior":["键盘在网格内导航","行选择与操作保持反馈"],"accessibility":["采用 grid 语义","焦点位置清晰"],"tokens":{"selectionMode":"single | multiselect","focusMode":"cell | row","sortable":"boolean"},"do":["为可操作列提供名称"],"dont":["不要用网格模拟普通列表"],"locales":{"en":{"sourceStatus":"Based on public design guidelines","category":"Data display","summary":"An enterprise data grid with sorting, selection, keyboard navigation, and columns.","anatomy":["Header row","Header cell","Row","Cell","Selection"],"states":["Default","Focused","Selected","Sorted","Loading"],"behavior":["Navigate the grid with keyboard","Keep row selection feedback visible"],"accessibility":["Use grid semantics","Keep focus location clear"],"do":["Name actionable columns"],"dont":["Do not use a grid to imitate a simple list"]}}}
