{"id":"arco-modal","name":"Modal","brandProfileId":"arco-design","sourceType":"public-guideline","sourceStatus":"基于公开设计规范","sourceUrl":"https://arco.design/react/components/modal","reviewedAt":"2026-08-13","platforms":["web","react","vue"],"category":"overlay","summary":"用于业务确认、结果反馈和短表单。","anatomy":["title","content","footer","close","mask"],"states":["closed","open","confirming","loading"],"behavior":["确认函数可返回异步结果","完成后关闭并刷新上下文"],"accessibility":["标题命名 modal","焦点进入并恢复"],"tokens":{"simple":"boolean","alignCenter":"boolean","maskClosable":"boolean"},"do":["让确认按钮说明结果"],"dont":["不要默认允许危险操作点遮罩关闭"],"locales":{"en":{"sourceStatus":"Based on public design guidelines","category":"Overlay","summary":"Handles business confirmation, result feedback, and short forms.","anatomy":["Title","Content","Footer","Close","Mask"],"states":["Closed","Open","Confirming","Loading"],"behavior":["Allow async confirmation","Close and refresh context after completion"],"accessibility":["Name the modal with a title","Move and restore focus"],"do":["Make confirmation labels describe outcomes"],"dont":["Do not let dangerous tasks dismiss on mask click by default"]}}}
